{
  "$schema": "../config/instance.schema.json",
  "schemaVersion": 1,
  "instanceId": "chiayi-bus",
  "site": {
    "name": "Mochi Bus E2E 2026-08-05",
    "canonicalOrigin": "request"
  },
  "transit": {
    "enabledCities": [
      "Chiayi"
    ],
    "defaultCity": "Chiayi",
    "demoQuery": null
  },
  "cloudflare": {
    "workerName": "chiayi-bus",
    "workersDev": true,
    "d1": {
      "databaseName": "chiayi-transit",
      "databaseId": null
    },
    "r2": {
      "bucketName": "chiayi-transit-shapes"
    },
    "rateLimits": {
      "standardNamespaceId": null,
      "expensiveNamespaceId": null
    }
  },
  "operations": {
    "profile": "starter",
    "snapshotSchedule": "manual",
    "releaseSmoke": true,
    "publicProbe": false,
    "windowWatchdog": false
  }
}
